<!ELEMENT libros (libro+)>
<!ELEMENT libro (titulo, autor*, isbn?, precioEU*)>
<!ELEMENT titulo (#PCDATA)>
<!ELEMENT autor (#PCDATA)>
<!ELEMENT isbn (#PCDATA)>
<!ELEMENT precioEU (#PCDATA)>